{
  "schemaVersion": "1.0",
  "environmentId": "m2-pro-mps-v1",
  "pythonVersion": "3.12.13",
  "platformTag": "macOS-15.6.1-arm64-arm-64bit",
  "hardware": {
    "cpu": "Apple M2 Pro",
    "memoryBytes": 17179869184,
    "accelerator": "Apple M2 Pro Metal 3",
    "acceleratorCores": 16
  },
  "packages": {
    "accelerate": "1.14.0",
    "huggingface-hub": "0.36.2",
    "numpy": "2.5.2",
    "safetensors": "0.8.0",
    "tokenizers": "0.22.2",
    "torch": "2.13.0",
    "transformers": "4.57.6"
  },
  "execution": {
    "device": "mps",
    "mixedPrecision": "none",
    "bitwiseDeterministic": false,
    "statisticalSeeds": [17, 42, 71]
  }
}
